sight translation training in interpreting education,2452
how to provide quality diplomatic interpreting,2453
on the dishes translation in banquet interpretation,2454
factors influencing information input in interpreting,2455
the use of contextual teaching in business english interpreting education,2456
on interpretation for the government foreign exchange activities,2457
on oral english interpretation skills on the constructionworksite,2458
new interpreting teaching model with vocational colleges characteristics,2459
technical interpreting and its application in scientific translation,2460
scientific training in technical interpreting,2461
on training of interpreting skills during english basic courses,2462
interpreting training for nonenglish majors,2463
the selection of interpretation course materials in higher vocational colleges,2464
practice and reflection of independent college interpretation teaching,2465
interpreting courses at privately funded institutes,2466
on the topicbased interpreting course in the civilianrun independent college,2467
a study on the chineseenglish interpreting teaching in independent colleges,2468
case study of how onsite noise affects interpreting qualities,2469
computer assisted interpreter training,2470
from the features of telephone interpreting and coping strategies,2471
interpreting idioms,2472
errors in interpreting a skopos theory perspective,2473
a study on the teaching mode of science and technology students interpreting ability,2474
assessing technical interpreting,2475
application of practical est interpreting techniques to upgrade the vocational skill,2476
logical issues in the technical interpreting of english,2477
semiotic perspectives textbook development for conference interpreter training,2478
emphasis on symbol system and logic structure,2479
standards of textuality for assessing teaching quality in english interpreting education,2480
meaning units in interpreting,2481
a study of the parisian school interpreter training model,2482
critical reflections on the interpretive theory of translation,2483
on application of task based approach in interpreting teaching under network enviroment,2484
on the application of internet resources in interpreting learning and teaching,2485
translation units in interpreting,2486
feasibility study on the longdistance education of escort interpreters,2487
deverbalization in chineseenglish interpreting training,2488
source input speed and the completeness of target delivery in englishchinese consecutive interpreting,2489
a contrastive study of ec consecutive interpretation text from thematic perspective,2490
listening barriers in englishchinese interpreting,2491
simplicity in notetaking for englishchinese interpreting,2492
english vs chinese sentence patterns and interpreting between them,2493
number errors in ec simultaneous interpreting,2494
numbers in englishchinese interpreting education,2495
the neccesity and probability of setting up interpretation related courses during lower grades,2496
a study on cultivating intercultural communication capacity in interpreting course of english major,2497
preliminary exploration on english major interpretation teaching mode,2498
tactical considerations of interpretation as a course for english majors with special reference to business english interpretation,2499
multimedia deployment in interpreter training for english majors,2500
how to improve english majors listening comprehension of interpretation,2501
the correlation between notetaking and chineseenglish interpreting performance for undergraduate english majors an empirical study,2502
interpreting numbers in english interpreting,2503
tips on identification and interpretation fuzzy information in interpreting,2504
a study on teachers role and function of teachers talk in the teaching of interpretation,2505
an empirical study of functional models in undergraduate english interpreting,2506
the art of english speech making and interpreting,2507
thoughts on the role of the teacher in business interpreting education,2508
revelation of community interpreting in the west,2509
a qualitative study of interpreting skills,2510
a study on application of sight translation in simultaneous interpreting teaching,2511
sight translation in undergraduate interpreting education,2512
a computerassisted interpreter training environment,2513
applying cognitive psychology to memory in interpreting,2514
correlation between cognitive skills and interpreting competence,2515
analysis of the application of interpreters memory mechanism in interpreting training,2516
subjectivity in interpreting,2517
on the third party involvement translating strategy in oral interpretation,2518
crosscultural communication skills in interpreting,2519
cognitive construction translation of classical proverbs quoted by wen jiabao at press conferences,2520
combining situational interpreting education with localization,2521
creative thinking in interpreter training,2522
interpreter training and textbooks,2523
obstacles in interpreter training and how to overcome them,2524
factors affecting listening comprehension in interpreting,2525
businessoriented interpreter training,2527
requisite skills for business interpreters,2528
on the reform of the interpreting teaching material in the local colleges and universities,2529
fundamental courses and interpreting education,2530
on quality cultivation of foreign affairs translators,2531
psycholinguistics in interpreting,2532
on phenomenon of china english in chineseenglish interpretation,2533
interpreting strategies for chinese proverbs,2534
on interpretations requirement and standard in different legal systems,2535
on the crosscultural awareness of the interpreters,2536
the essential roles of notetaking in interpreting,2537
english interpreter quality requirements and interpreting technique,2538
interactive teaching of english interpreting,2539
on strategies for translating sentences with subjunctive mood in the interpretation course,2540
on press conference interpretation strategies,2541
successful discoursebased interpreting,2542
the implications of seleskovitchs triangular model on the establishment of interpreting quality assessment standards,2543
simultaneous interpretation under the theory of sense,2544
a discussion on the feasibility of interpreting course for nonenglish major undergraduates,2545
professional ethics for interpreters,2546
the five preparation before translation,2547
schemata and their effect on interpreting quality,2548
a study on standardization of college interpretation test,2549
try to discuss interpretation records in the process of impromptu translation,2550
analysis and countermeasures of sl effect in interpretation,2551
interpreting testing and quality assessment,2552
features of and approaches to diplomatic interpreting,2553
on explicitation of official slogans in ce interpretation,2554
interpreting strategies for business negotiations,2555
adoption of business interpreting courses at vocational schools,2556
on interpreter education,2557
the application of interpretation techniques under the register a case study of a conference interpretation based on the theory of translation process,2558
the role of context in interpreting,2559
interpreting research from a contextual perspective,2560
on interpretation study from the perspective of context,2561
assessing interpreting quality in a classroom setting,2562
perlocutionary agreement in interpreting classical chinese proverbs,2563
on court hearing interpretation in judicial adjudication,2564
cooperative learning in business english interpreting,2565
simultaneous interpreting with written cues,2566
approaches and techniques for simultaneous interpreting,2567
errors in chineseenglish consecutive interpreting,2568
quality assessment in interpreting competitions,2569
role shift in dialogue interpreting,2570
crosscultural awareness and english interpreting,2572
training interpreters for business negotiations in liaoning,2573
the use of english proficiency test activities in chineseenglish interpretation proficiency examination,2574
logical thinking and comprehension in interpreting,2575
interpreting strategies for press conferences using the interpretive theory of translation,2576
selftraining for vocational school students an interpretive theory of translation approach,2577
a practical study of the theory of sense on the promotion of interpretation teaching,2578
undergraduate interpreter training for english majors an interpretive theory of translation perspective,2579
the application of interpretation schools theory in foreign affairs interpreting,2580
applying the interpretive theory of translation in chineseenglish interpreter training,2581
exploration and practice of offering the optional course of medical interpretation for medical students,2582
elective interpreting courses for nonenglish majors,2583
the construction of a learnerbased interpreting selfregulated learning website theory and practice,2584
audiovisual materials applied in interpreter training,2585
an analytical study of the application of theory in interpreting,2586
prefabricated chunks to assist working memory in interpreting,2587
an analysis into the court interpreting system in hong kong,2588
situation solutions of oral interpretation teaching in college english in university,2589
teaching interpreting at universities,2590
assessment of interpreting skills of university english majors and the implications for interpreting education,2591
current status of interpretation in higher vocational colleges and cultivation system of professional qualities,2592
modular interpreting education at vocational schools,2593
an overview of the curriculum for business interpreting courses at vocational schools,2594
application of case teaching and new mode of businss english interpretation teaching,2596
on business interpreting in higher vocational colleges,2597
english interpreter training at vocational schools and 3p training models,2598
an exploration of the correlation between faithfulness and communication in translation,2599
bilingual courses an indispensable component in professional translator and interpreter training,2600
from languaga testing professional education interpreters made in vienna,2601
chinese stls and mtis a golden opportunity,2602
thoughts and practice over an effective si teaching model at undergraduate level fudan case study zoomin,2603
the cognitive characteristics of the interpretation and the teaching of the interpretation,2604
noise analysis of interpreting process,2605
to revise the content related to interpreting teaching in the general syllabus an urgent task,2606
interpreting quality basic criteria and multiple perspectives,2607
a survey of and a reflection on interpreting studies in china,2608
si quality assessment from the perspective of communication with empirical study evidence,2609
interpersonal mediation of the interpreter in political press conference,2610
application of the podcast technology to interpreting teaching,2611
the dialogue interpreters visibility,2612
simultaneous interpretation between chinese and english placing the challege in perspective,2613
on the making of corpusbased interpretation textbooks for translation majors,2614
teaching interpreting as a major a survey of models of curriculum designing modes of teaching and methods of teaching,2615
interpreting into b issues and their solutions in china,2616
the episodic buffer and its implication for simultaneous interpreting training,2617
an examination of the demand for foreign languages via translation and interpretation services,2618
rationale and methods of conducting the learning by doing way of teaching for ma students in interpreting programme,2619
interpreting corpus a new approach to interpreting teaching and research,2620
application of mental lexicon theory in interpreting studies a preliminary study on building bilingual mental lexicon representation model of interpreters,2621
pedagogical aspects for bti and mti interpreting education,2622
evs and target language rendition in chinese to english simultaneous interpretation,2623
knowledge requirements formula for interpreters and interpreting training,2624
comprehension barriers in englishchinese interpreting and relevant coping strategies,2625
the application of pbl in english interpreting course,2626
podcast in interpreting teaching,2627
topic selection and teaching material utilization in topicbased interpreting course,2628
interpreting research in china past and present,2629
social status of interpreters in china today,2630
investigation on the inadequate training for interpreters in chinese universities,2631
interpreting accounting issues in business negotiations,2632
role of the interpreter in press conferences,2633
explicitation in chineseenglish consecutive interpreting a case study,2634
principles for interpreting numbers between chinese and english,2635
challenges and strategies for chineseenglish interpreter training,2636
similarities between chinese and western interpreting research,2637
cultural differences and english escort interpreting a case study of meizhou,2638
factors influencing the quality of the interpretation from chinese to foreign languages,2639
how to interpret chinese dishes,2640
thematic progression and simultaneous interpreting,2641
interactive interpreting education research,2642
interpreting numbers in consecutive interpreting,2643
quick notes in consecutive interpretation,2644
shortterm memory and notetaking in consecutive interpreting,2645
skills cultivationtargeted consecutive interpretation teaching contents principles and models,2646
a study on interpreting from the perspective of communication strategies,2647
testing validity under the framework of the communicative language testing theory,2648
the interpretation of multidigit numbers from the perspective of chineseenglish number differences,2649
features and principles of televised simultaneous interpreting a communication studies approach,2650
interpreting hunanflavored delicacies a functionalist perspective,2651
curricular design and oral interpretation for undergraduates,2652
reforming interpreting courses at vocational schools an efforts model approach,2653
pragmatic failures in business interpreting,2654
the cognitive process in listening comprehension during interpreting a skopos theory perspective,2655
the making of an interpreter a case study of work on president bushs speech at tsinghua university,2656
information transmission in interpreting an acceptance theory perspective,2657
reflections on the teaching of interpreting from the perspective of theory of interpretational school,2658
infidelity in interpreting a skopos theory perspective,2659
cultural limitations in the strategy choice of guide interpretation from the perspective of skopos theory,2660
interpretive theory of translation and natural science in interpreting a research methodology perspective,2661
role shift and business interpreting,2662
fidelity and latitude in interpreting an interpretive theory of translation approach,2663
a case study of interpreting for press conferences with senior government officials,2664
a job processoriented curriculum design a case study of business interpreting programs,2665
principles of communication in corporate interpreter certification,2666
categorization and naming issues in conference interpreting,2667
on preconference preparations in conference interpreting,2668
application of metacognition theory in business interpreting education,2669
interpreting assessment for test for english majors8,2670
oral interpretation and public speaking skill an interpretive theory apporach,2671
effective memorization methods in interpreting,2672
research on business interpreting,2673
relevance theory and chinese interpreters vocational education analysis of the guidance of the ternary relations metacognition in interpretation activities,2674
on the application of relevance theory in interpretation,2675
the interpretive power of relevance theory on interpreters listening comprehension,2676
the interpretive power of relevance theory,2677
content schemata in interpretation,2678
interpretation of chinese quotations,2679
teaching consecutive interpreting to beginners,2680
how to communicate and establish authority between medical interpreters and professionals,2681
the effect of source language on interpreting performance a case study of a 2008 press conference with wen jiabao,2682
techniques in escort interpreting,2683
interpreting curriculum design and teaching approaches,2684
a themebased interpreting website designing computerassisted education models,2685
bridging the eastwest cultural gap in interpreting,2686
the role of comprehension and psychology in interpreting,2687
techniques for the english interpretation of chinese buzzwords,2688
compensating for cultural differences in interpreting,2689
bridging cultural gaps in interpreting,2690
strategies on cultural translation in interpretation,2691
ambiguity in interpreting,2692
listening comprehension and memory in interpreting,2693
short term memory in interpreting and its training,2694
on crosscultural pragmatic failure of interpreting and its coping strategies,2695
lexical gaps in interpreting,2696
an exploration of interpreting competence,2697
developing skills in interpreting,2698
how to raise crosscultural awareness in interpreting,2699
role of the community interpreters roles in business court and in the deafmute community,2700
dynamic contextual elements in interpreting preparation,2701
cardinal rules of interpreting,2702
listening comprehension in interpreting and methods for improving it,2703
how to address missing linguistic information in interpreting,2704
memory training methods for interpreting,2705
developing crosscultural awareness in interpreting,2706
deduction in simultaneous interpreting,2707
interpreter training for professionals,2708
developing lexical competence in interpreter education,2709
discourse analysis in interpreter training,2710
adversity training in interpreting education,2711
adverse environment practice in interpreting education,2712
developing transcoding skills in interpreting education,2713
the understanding of interpretation course,2714
objective positioning for interpreting teaching and cultivating the specialized interpreters,2715
interpretation characteristics and interpreter training,2716
the cultural function of interpretation and its translation strategy,2717
professionalization in interpreting current development of interpreting in shanghai and jiangsu province,2718
a few ideas on notetaking in interpreting,2719
interpreter certification in the context of industry professionalization,2720
cognitive memorys role in simultaneous interpreting practice a survey on omissions in interpreting,2721
memory and cognitive psychology in interpreting,2722
on the psychological foundation of memory in interpretation and strategies of memorization,2723
interpreting corpus some theoretical and practical issues,2724
teacherstudent interaction in interpreting classes,2725
analysis of errors in interpreting courses,2726
a research on the interpretation curriculum development,2727
development and application of interpreting course models models centered on cultivating interpreters abilities,2728
the necessity and strategies of constructing interpreting course group,2729
bridging the cultural divide in interpreting,2730
a preliminary exploration of the zero hour course concept in interpreting education,2732
the professionalization of interpreting in taiwan,2733
a preliminary study of student perspectives on interpretation courses as continuing education programs in taiwan,2734
teaching college level interpretation in taiwan,2735
application of cooperative learning to interpreter training,2736
the feasibility of peer review in interpreting education,2737
communication strategies in simultaneous interpretation and their relation to interpreting grades,2738
communication strategies for simultaneous interpreting,2739
syntactic linearity and nonlinear translation in simultaneous interpreting,2740
working memory and simultaneous interpreting performance,2741
analysis of interpreter subjectivity in business interpreting,2742
on the modes and the contexts of business interpretation,2744
training philosophies for business english interpreting,2745
a report on the interpreting skills of business english majors,2746
bridging the cultural divide in business negotiations,2747
a study of interpreting textbooks1988 2008,2748
interpretation studies in china,2749
schema theory and its use in interpreter training,2750
evaluation of faithfulness in interpreting from the perspective of schema theory,2751
comprehension in interpreting a skopos theory study,2752
an empirical study on the development of interpreting courses for nonenglish majors,2753
the design of a fms independent learning system for interpretation,2754
a multimediabased ads interpreter training model,2755
workstudy interpreter training model,2756
web site designing for english interpretation course a constructivism view,2757
on the network and corpora based interpretation teaching strategy,2758
on networkbased teaching platform for supporting interpreting teaching,2759
anaphoric structure applied in interpreting the relationship between interpreting and spoken language,2760
gaining competence in interpreting for foreign language majors,2761
language innovation labs and the training of professional interpreters,2762
a threestep training program for multimedia interpreting,2763
application of multimedia teaching method to spoken english teaching,2764
the problems of university english interpreting education and how to solve them,2766
a few thoughts on tertiarylevel english interpreting education,2767
reforming english interpreting education in tertiary institutions a processoriented approach,2768
the situation of interpretation industry in dalian and suggestions on interpretation teaching reform,2769
on how listening and speaking courses for lower grade students contribute to oral interpretation for them when in their upper grades,2770
how to improve interpreting competence for english majors,2771
how to balance notetaking and memory in consecutive interpreting,2772
on strategies of training practical interpreters at undergraduate level,2773
a few ideas on english interpreting education,2774
approaches for overcoming cultural barriers in tourguide interpreting,2775
cohesion issues in interpreting,2776
working memory and interpreting memory,2777
working memory and directionality in simultaneous interpreting,2778
parisian interpretive theory an overview,2779
an intial exploration of training professional interpreters in guangxi,2780
constructivism and multidimensional interpreter training,2781
strategies for dealing with idioms in interpreting domestication,2782
factors affecting the effectiveness of interpreting,2783
how to improve interpretation skills for interpreters,2785
the evolution of chinas interpretation the backgrounds and characteristics,2786
signed language interpreting and spoken language interpreting differences and similarities,2787
application of taskdriven teaching method in teaching business interpreting course,2788
improving interpreting education at the university level,2789
cultural differences and pragmatic failure in interpreting,2790
teaching interpreting in a new era,2792
teaching technical english interpreting in tertiary institutions,2793
memorization in englishchinese interpreting for landscaping and design,2794
analysis on problems of interpretation teaching for english majors and reform countermeasures,2795
memes and universitylevel interpreter training,2796
interpretation class for twoyear english program in private universities,2797
explicitation in the chineseenglish conference interpreting and its motivation,2798
cultural default in ce interpretation example analysis possible solutions,2799
strategies for being succinct in chineseenglish interpreting,2800
communication model and its implications on interpreter training,2801
court interpreting standards explored,2802
ambiguity in legal interpreting,2803
an analysis of notetaking in interpreting,2804
the lack of standardization in interpreting practice,2805
memory structures in interpreting,2806
two major influences on interpreting,2807
culturallyembedded expressions in interpreting,2808
training english interpreting professionals at vocational schools,2809
new trends in the foreign language interpreting markets of guangdong hong kong and macau,2810
on interpreting as a profession,2811
listening comprehension memory and conversion of information in interpreting education,2812
memory in interpreting,2813
translation of figures in interpreting,2814
essential components for success in interpreting,2815
misconceptions about simultaneous interpreting,2816
techniques for interpreting at press conferences,2817
interpreting at hydroelectric industry conferences,2818
on the training of legal english interpreters,2819
interpreting techniques for tour guides,2820
interpreting competence what it consists of and how to develop it,2821
the value of pragmatics in english interpreting,2822
features and methodology in interpreting education at vocational schools,2823
the blended interpretation course a teaching solution incorporating mit opencourseware,2824
target language quality and field interpreting,2825
use of mock conferences in teaching business interpreting at vocational schools,2826
an exploration of telephone interpreting,2827
an empirical study of anticipation in ceremonial interpreting,2829
social learning theory a probe into the teaching of interactive interpretation,2830
community interpreting in china,2831
telephone interpreting as a new trend in community interpreting,2832
cultivating mental fortitude in technical interpreters,2833
